{
  "stack": "laravel",
  "commit_type": "feat",
  "mode": "interactive",
  "phases": [
    {
      "name": "Context",
      "agents": [
        {
          "id": "01_ticket_reader",
          "input": "<paste ticket>",
          "expects": "TicketContext"
        }
      ]
    },
    {
      "name": "Domain Expert (suggested)",
      "agents": [
        {
          "id": "01_domain_expert",
          "input": "<use agents/01_domain_expert.md (Payroll MX - Legal) + (Payroll MX - Calculations)>",
          "expects": "DomainKnowledgePack"
        }
      ]
    },
    {
      "name": "Backlog",
      "agents": [
        {
          "id": "02_product_analyst",
          "input": "<ticket + DomainKnowledgePacks[]>",
          "expects": "Backlog"
        }
      ]
    }
  ],
  "notes": [
    "Ticket is compliance-heavy and author is not IMSS expert \u2192 run 1..2 Domain Expert packs first.",
    "Backlog AC must reference the packs; keep conflicts as open_questions."
  ]
}
